{
  "schema_version": "1", "repository": "AndrewMaged814/safelane-demo", "service": "demo-api",
  "base_sha": "29a1997f463c7acb7d2e51aa4ee95fa8b3d4a602", "head_sha": "f43738b1fe17f55ff127fd5555bd4211e58c5797",
  "policy_version": "2026.08.3", "image_catalog_version": "2026.08.1",
  "image_catalog_sha256": "sha256:eeeeeeeeeeeeeeeeeeeeeeeeeeeeeeeeeeeeeeeeeeeeeeeeeeeeeeeeeeeeeeee",
  "image_ref": "safelane-demo:f43738b1fe17f55ff127fd5555bd4211e58c5797",
  "image_id": "sha256:bbbbbbbbbbbbbbbbbbbbbbbbbbbbbbbbbbbbbbbbbbbbbbbbbbbbbbbbbbbbbbbb",
  "runtime_image_id": "sha256:bbbbbbbbbbbbbbbbbbbbbbbbbbbbbbbbbbbbbbbbbbbbbbbbbbbbbbbbbbbbbbbb"
}
